cubeLight; cubeLight; cubeLight; cubeDark,cubeLight; cubeLight; cubeLight; cubeLight,cubeLight; cubeLight; cubeDark; cubeDark,cubeDark; cubeDark; cubeDark; cubeDark
cubeLight; cubeLight; cubeDark; cubeLight,cubeLight; cubeLight; cubeLight; cubeDark,cubeDark; cubeLight; cubeLight; cubeDark,cubeDark; cubeDark; cubeDark; 
cubeLight; cubeDark; cubeLight; cubeLight,cubeLight; cubeLight; cubeDark; cubeDark,cubeDark; cubeDark; cubeLight; cubeLight,cubeLight; cubeDark; ; 
cubeDark; cubeLight; cubeLight; cubeLight,cubeLight; cubeLight; cubeDark; cubeLight,cubeLight; cubeDark; cubeDark; cubeLight,cubeDark; cubeDark; ; cubeDark
,cubeLight; cubeDark; cubeDark; cubeLight,,cubeDark; ; ; cubeLight
,cubeLight; cubeDark; cubeLight; cubeLight,,cubeDark; ; cubeDark; cubeDark
,cubeDark; cubeDark; cubeLight; cubeLight,,; ; cubeLight; cubeDark
,cubeDark; cubeLight; cubeLight; cubeLight,,; cubeDark; cubeDark; cubeDark
,cubeDark; cubeLight; cubeLight; cubeDark,,; cubeLight; cubeDark; 
